{
  "schema_version": "data-contract/1.0.0",
  "data_version": "synthetic-base/1.0.0",
  "fixture_id": "FIXTURE-PLANNED-INBOUND",
  "provenance": {
    "mode": "SYNTHETIC",
    "created_by": "NourishOps build-context team",
    "description": "Synthetic four-week inbound schedule before scenario overlays are applied."
  },
  "records": [
    {"inbound_id":"INB-USDA-PROTEIN-104","warehouse_id":"WH-CENTRAL-01","expected_week_start":"2026-08-03","category_id":"PROTEIN","gross_quantity_lb":10000,"source_type":"USDA","status":"CONFIRMED","arrival_probability":1.0,"storage_type":"FROZEN","expected_usable_yield_ratio":1.0,"usable_life_days":60,"evidence_ids":["EVD-BASE-INBOUND-LEDGER"],"record_version":1,"provenance_id":"PROV-SYNTHETIC-INBOUND"},
    {"inbound_id":"INB-DONATION-PROTEIN-117","warehouse_id":"WH-CENTRAL-01","expected_week_start":"2026-08-17","category_id":"PROTEIN","gross_quantity_lb":9000,"source_type":"DONATION","status":"CONFIRMED","arrival_probability":1.0,"storage_type":"FROZEN","expected_usable_yield_ratio":1.0,"usable_life_days":45,"evidence_ids":["EVD-BASE-INBOUND-LEDGER"],"record_version":1,"provenance_id":"PROV-SYNTHETIC-INBOUND"},
    {"inbound_id":"INB-DONATION-PROTEIN-118","warehouse_id":"WH-CENTRAL-01","expected_week_start":"2026-08-24","category_id":"PROTEIN","gross_quantity_lb":9000,"source_type":"DONATION","status":"CONFIRMED","arrival_probability":1.0,"storage_type":"FROZEN","expected_usable_yield_ratio":1.0,"usable_life_days":45,"evidence_ids":["EVD-BASE-INBOUND-LEDGER"],"record_version":1,"provenance_id":"PROV-SYNTHETIC-INBOUND"},

    {"inbound_id":"INB-DONATION-PRODUCE-201","warehouse_id":"WH-CENTRAL-01","expected_week_start":"2026-08-03","category_id":"PRODUCE","gross_quantity_lb":10000,"source_type":"DONATION","status":"CONFIRMED","arrival_probability":1.0,"storage_type":"REFRIGERATED","expected_usable_yield_ratio":1.0,"usable_life_days":7,"evidence_ids":["EVD-BASE-INBOUND-LEDGER"],"record_version":1,"provenance_id":"PROV-SYNTHETIC-INBOUND"},
    {"inbound_id":"INB-DONATION-PRODUCE-202","warehouse_id":"WH-CENTRAL-01","expected_week_start":"2026-08-10","category_id":"PRODUCE","gross_quantity_lb":14000,"source_type":"DONATION","status":"CONFIRMED","arrival_probability":1.0,"storage_type":"REFRIGERATED","expected_usable_yield_ratio":1.0,"usable_life_days":7,"evidence_ids":["EVD-BASE-INBOUND-LEDGER"],"record_version":1,"provenance_id":"PROV-SYNTHETIC-INBOUND"},
    {"inbound_id":"INB-DONATION-PRODUCE-203","warehouse_id":"WH-CENTRAL-01","expected_week_start":"2026-08-17","category_id":"PRODUCE","gross_quantity_lb":14000,"source_type":"DONATION","status":"CONFIRMED","arrival_probability":1.0,"storage_type":"REFRIGERATED","expected_usable_yield_ratio":1.0,"usable_life_days":7,"evidence_ids":["EVD-BASE-INBOUND-LEDGER"],"record_version":1,"provenance_id":"PROV-SYNTHETIC-INBOUND"},
    {"inbound_id":"INB-DONATION-PRODUCE-204","warehouse_id":"WH-CENTRAL-01","expected_week_start":"2026-08-24","category_id":"PRODUCE","gross_quantity_lb":14000,"source_type":"DONATION","status":"CONFIRMED","arrival_probability":1.0,"storage_type":"REFRIGERATED","expected_usable_yield_ratio":1.0,"usable_life_days":7,"evidence_ids":["EVD-BASE-INBOUND-LEDGER"],"record_version":1,"provenance_id":"PROV-SYNTHETIC-INBOUND"},

    {"inbound_id":"INB-USDA-DAIRY-301","warehouse_id":"WH-CENTRAL-01","expected_week_start":"2026-08-03","category_id":"DAIRY","gross_quantity_lb":6000,"source_type":"USDA","status":"CONFIRMED","arrival_probability":1.0,"storage_type":"REFRIGERATED","expected_usable_yield_ratio":1.0,"usable_life_days":14,"evidence_ids":["EVD-BASE-INBOUND-LEDGER"],"record_version":1,"provenance_id":"PROV-SYNTHETIC-INBOUND"},
    {"inbound_id":"INB-USDA-DAIRY-302","warehouse_id":"WH-CENTRAL-01","expected_week_start":"2026-08-10","category_id":"DAIRY","gross_quantity_lb":6000,"source_type":"USDA","status":"CONFIRMED","arrival_probability":1.0,"storage_type":"REFRIGERATED","expected_usable_yield_ratio":1.0,"usable_life_days":14,"evidence_ids":["EVD-BASE-INBOUND-LEDGER"],"record_version":1,"provenance_id":"PROV-SYNTHETIC-INBOUND"},
    {"inbound_id":"INB-USDA-DAIRY-303","warehouse_id":"WH-CENTRAL-01","expected_week_start":"2026-08-17","category_id":"DAIRY","gross_quantity_lb":6000,"source_type":"USDA","status":"CONFIRMED","arrival_probability":1.0,"storage_type":"REFRIGERATED","expected_usable_yield_ratio":1.0,"usable_life_days":14,"evidence_ids":["EVD-BASE-INBOUND-LEDGER"],"record_version":1,"provenance_id":"PROV-SYNTHETIC-INBOUND"},
    {"inbound_id":"INB-USDA-DAIRY-304","warehouse_id":"WH-CENTRAL-01","expected_week_start":"2026-08-24","category_id":"DAIRY","gross_quantity_lb":6000,"source_type":"USDA","status":"CONFIRMED","arrival_probability":1.0,"storage_type":"REFRIGERATED","expected_usable_yield_ratio":1.0,"usable_life_days":14,"evidence_ids":["EVD-BASE-INBOUND-LEDGER"],"record_version":1,"provenance_id":"PROV-SYNTHETIC-INBOUND"},

    {"inbound_id":"INB-USDA-GRAINS-401","warehouse_id":"WH-CENTRAL-01","expected_week_start":"2026-08-03","category_id":"GRAINS","gross_quantity_lb":10000,"source_type":"USDA","status":"CONFIRMED","arrival_probability":1.0,"storage_type":"DRY","expected_usable_yield_ratio":1.0,"usable_life_days":180,"evidence_ids":["EVD-BASE-INBOUND-LEDGER"],"record_version":1,"provenance_id":"PROV-SYNTHETIC-INBOUND"},
    {"inbound_id":"INB-USDA-GRAINS-402","warehouse_id":"WH-CENTRAL-01","expected_week_start":"2026-08-10","category_id":"GRAINS","gross_quantity_lb":10000,"source_type":"USDA","status":"CONFIRMED","arrival_probability":1.0,"storage_type":"DRY","expected_usable_yield_ratio":1.0,"usable_life_days":180,"evidence_ids":["EVD-BASE-INBOUND-LEDGER"],"record_version":1,"provenance_id":"PROV-SYNTHETIC-INBOUND"},
    {"inbound_id":"INB-USDA-GRAINS-403","warehouse_id":"WH-CENTRAL-01","expected_week_start":"2026-08-17","category_id":"GRAINS","gross_quantity_lb":10000,"source_type":"USDA","status":"CONFIRMED","arrival_probability":1.0,"storage_type":"DRY","expected_usable_yield_ratio":1.0,"usable_life_days":180,"evidence_ids":["EVD-BASE-INBOUND-LEDGER"],"record_version":1,"provenance_id":"PROV-SYNTHETIC-INBOUND"},
    {"inbound_id":"INB-USDA-GRAINS-404","warehouse_id":"WH-CENTRAL-01","expected_week_start":"2026-08-24","category_id":"GRAINS","gross_quantity_lb":10000,"source_type":"USDA","status":"CONFIRMED","arrival_probability":1.0,"storage_type":"DRY","expected_usable_yield_ratio":1.0,"usable_life_days":180,"evidence_ids":["EVD-BASE-INBOUND-LEDGER"],"record_version":1,"provenance_id":"PROV-SYNTHETIC-INBOUND"},

    {"inbound_id":"INB-PURCHASE-STAPLES-501","warehouse_id":"WH-CENTRAL-01","expected_week_start":"2026-08-03","category_id":"STAPLES_MIXED_MEALS","gross_quantity_lb":9000,"source_type":"PURCHASE","status":"CONFIRMED","arrival_probability":1.0,"storage_type":"DRY","expected_usable_yield_ratio":1.0,"usable_life_days":180,"evidence_ids":["EVD-BASE-INBOUND-LEDGER"],"record_version":1,"provenance_id":"PROV-SYNTHETIC-INBOUND"},
    {"inbound_id":"INB-PURCHASE-STAPLES-502","warehouse_id":"WH-CENTRAL-01","expected_week_start":"2026-08-10","category_id":"STAPLES_MIXED_MEALS","gross_quantity_lb":9000,"source_type":"PURCHASE","status":"CONFIRMED","arrival_probability":1.0,"storage_type":"DRY","expected_usable_yield_ratio":1.0,"usable_life_days":180,"evidence_ids":["EVD-BASE-INBOUND-LEDGER"],"record_version":1,"provenance_id":"PROV-SYNTHETIC-INBOUND"},
    {"inbound_id":"INB-PURCHASE-STAPLES-503","warehouse_id":"WH-CENTRAL-01","expected_week_start":"2026-08-17","category_id":"STAPLES_MIXED_MEALS","gross_quantity_lb":9000,"source_type":"PURCHASE","status":"CONFIRMED","arrival_probability":1.0,"storage_type":"DRY","expected_usable_yield_ratio":1.0,"usable_life_days":180,"evidence_ids":["EVD-BASE-INBOUND-LEDGER"],"record_version":1,"provenance_id":"PROV-SYNTHETIC-INBOUND"},
    {"inbound_id":"INB-PURCHASE-STAPLES-504","warehouse_id":"WH-CENTRAL-01","expected_week_start":"2026-08-24","category_id":"STAPLES_MIXED_MEALS","gross_quantity_lb":9000,"source_type":"PURCHASE","status":"CONFIRMED","arrival_probability":1.0,"storage_type":"DRY","expected_usable_yield_ratio":1.0,"usable_life_days":180,"evidence_ids":["EVD-BASE-INBOUND-LEDGER"],"record_version":1,"provenance_id":"PROV-SYNTHETIC-INBOUND"}
  ]
}
